{"schema_version":"roboguide.mission-request/v0.4","request_id":"request-5a564773d0db41dc851a65bbefc88409","mission_id":"mission-04abe8ac38a64367b60a272dff8920d3","dialogue":[{"turn_id":"turn-0001","speaker":"User","kind":"Instruction","content":"Two heterogeneous robots (a legged Spot and a wheeled Fetch) operate in one shared multi-floor scene. Complete the benchmark objective: ensure that a robot reaches the object any_targets|0, and ensure that a robot reaches the goal receptacle position TARGET_any_targets|0. Decide yourselves how to divide the work between the available robots and carry it out.","created_at_ms":1789576869889,"in_reply_to":null}],"lifecycle":"Failed","assessment":{"objective":"Complete the benchmark by ensuring that a robot reaches object any_targets|0 and that a robot reaches the goal receptacle position TARGET_any_targets|0.","constraints":["Operate within the shared multi-floor scene using the available Spot and Fetch robots.","Robot assignment and division of work are delegated to the system."],"assumptions":["The object-reach and receptacle-position-reach conditions may be satisfied by the same robot or by different robots, as determined by the system.","Reaching the specified locations is sufficient; no pickup, transport, placement, or handoff is implied."],"open_questions":[]},"plan":null,"grounding_context":{"schema_version":"roboguide.grounding-context/v0.1","context_digest":"sha256:6b13a3c9fcac88e898785fce941b23a6d8e6c96c6655437867949eeb2a8e8b3f","request_id":"request-5a564773d0db41dc851a65bbefc88409","dialogue_digest":"sha256:ae339e86391dbeab9296ae57805a7e4403ba66e06b9748d5a052a90d32108c0d","captured_at_ms":1789576869914,"selection_policy_ref":"roboguide.mission-grounding/admitted-world-and-global-memory/v0.2#world-payload-schemas=sha256:4f53cda18c2baa0c0354bb5f9a3ecbe5ed12ab4d8e11ba873c2f11161202b945","state_evidence":[],"memory_evidence":[],"gaps":[]},"draft_revision":0,"draft_digest":null,"approval_required":false,"approval_reasons":[],"issues":["timed out"],"repair_attempts":0,"review_history":[],"created_at_ms":1789576869889,"updated_at_ms":1789576975390}