{"schema_version":"roboguide.mission-request/v0.4","request_id":"request-ff571d65419c46c7b6736f9c580809a9","mission_id":"mission-bef0c1f7fa244721bf7d3231aa064983","dialogue":[{"turn_id":"turn-0001","speaker":"User","kind":"Instruction","content":"Two heterogeneous robots (a legged Spot and a wheeled Fetch) operate in one shared multi-floor scene. Complete the benchmark objective: ensure that a robot reaches the object any_targets|0, and ensure that a robot reaches the goal receptacle position TARGET_any_targets|0. Decide yourselves how to divide the work between the available robots and carry it out.","created_at_ms":1789581627945,"in_reply_to":null}],"lifecycle":"Accepted","assessment":{"objective":"Ensure that a robot reaches the object identified as any_targets|0 and that a robot reaches the goal receptacle position identified as TARGET_any_targets|0.","constraints":["Use the available Spot and Fetch robots in the shared multi-floor scene.","Choose the division of work between the robots without requiring further user direction."],"assumptions":["The robot reaching the object and the robot reaching the goal receptacle need not be distinct; assignment is left to the system."],"open_questions":[]},"plan":{"schema_version":"roboguide.mission-plan/v0.7","mission":{"id":"mission-bef0c1f7fa244721bf7d3231aa064983","objective":"Ensure that a robot reaches the object identified as any_targets|0 and that a robot reaches the goal receptacle position identified as TARGET_any_targets|0.","actors":[{"id":"spot"},{"id":"fetch"}]},"contexts":[{"id":"shared-multi-floor-scene","roles":[{"id":"spot-context-role","actor":"spot"},{"id":"fetch-context-role","actor":"fetch"}],"relations":[],"coupling_mode":"independent"}],"tasks":[{"id":"reach-object","description":"The Spot robot reaches the object identified as any_targets|0.","depends_on":[],"roles":[{"id":"spot-reach-object-role","context_role":"spot-context-role","requirements":{"capabilities":[{"contract":{"namespace":"mobility","name":"move","version":"v1"},"constraints":[]}],"resources":[]},"execution_intent":{"operation":{"namespace":"mobility","name":"move","version":"v1"},"objective":"Reach the object identified as any_targets|0.","parameters":{"destination":"any_targets|0"}},"resource_scope":"task"}],"context_id":"shared-multi-floor-scene","coupling_mode":"independent","timing":{"earliest_start_offset_ms":0,"latest_start_offset_ms":null,"completion_deadline_offset_ms":null},"satisfaction":{"expected_effect":"The Spot robot reaches the object identified as any_targets|0.","basis":"execution-report","verifier":null}},{"id":"reach-goal-receptacle","description":"The Fetch robot reaches the goal receptacle position identified as TARGET_any_targets|0.","depends_on":[],"roles":[{"id":"fetch-reach-goal-role","context_role":"fetch-context-role","requirements":{"capabilities":[{"contract":{"namespace":"mobility","name":"move","version":"v1"},"constraints":[]}],"resources":[]},"execution_intent":{"operation":{"namespace":"mobility","name":"move","version":"v1"},"objective":"Reach the goal receptacle position identified as TARGET_any_targets|0.","parameters":{"destination":"TARGET_any_targets|0"}},"resource_scope":"task"}],"context_id":"shared-multi-floor-scene","coupling_mode":"independent","timing":{"earliest_start_offset_ms":0,"latest_start_offset_ms":null,"completion_deadline_offset_ms":null},"satisfaction":{"expected_effect":"The Fetch robot reaches the goal receptacle position identified as TARGET_any_targets|0.","basis":"execution-report","verifier":null}}]},"grounding_context":{"schema_version":"roboguide.grounding-context/v0.1","context_digest":"sha256:a7287451e8c0f3211b00e061d749f4f190aaf585206d0f67d44f75efd46f13e5","request_id":"request-ff571d65419c46c7b6736f9c580809a9","dialogue_digest":"sha256:18cdc948a690eec339c2cc29516a75d79c9d11fc5b6e40d7a24386ee5058c003","captured_at_ms":1789581627971,"selection_policy_ref":"roboguide.mission-grounding/admitted-world-and-global-memory/v0.2#world-payload-schemas=sha256:4f53cda18c2baa0c0354bb5f9a3ecbe5ed12ab4d8e11ba873c2f11161202b945","state_evidence":[],"memory_evidence":[],"gaps":[]},"draft_revision":1,"draft_digest":"sha256:4f015d68ac42b3163466baccbc849809494cbf50d813854175ed1b16321e7d7b","approval_required":false,"approval_reasons":[],"issues":[],"repair_attempts":0,"review_history":[{"draft_revision":1,"draft_digest":"sha256:4f015d68ac42b3163466baccbc849809494cbf50d813854175ed1b16321e7d7b","grounding_context_digest":"sha256:a7287451e8c0f3211b00e061d749f4f190aaf585206d0f67d44f75efd46f13e5","review":{"approved":true,"issues":[]},"reviewed_at_ms":1789581716123}],"created_at_ms":1789581627945,"updated_at_ms":1789581716173}